0,"Great washing machine.  Have been using it for almost a year without any problem. Cleans well and has many functions like soak, delicate wash, quick wash, quiet wash, tub clean and air dry.  The glass top lid gives it a great look and it is not too noisy.   Since it is agitator-less, it can accommodate more clothes and feels more than 6.5 kg capacity.   It is big enough for our family of four (2 adults and 2 children)."
1,Gave one star because I couldn't find '-' or '0' star. after so many complaints about lint filter not working well how come company still selling this product in the market. I feel like i bought this machine to ruin my clothes. I am stuck with this machine bcoz I've  paid $1000 and tried to sale it online but the resale value is just $300. What a shame!!!
2,"Every couples of years I need to replace a washing machine, when I bought LG washing machine from a retailer in 2009 to now is about 10 years time I still use it."
3,Machine 1 year old and it damages clothes- stretches it and leaves lint on half load.
4,"What is even more of a headache is the LG customer service (offshore) - the most terrible customer service i've ever received- inconsistent, lacks care, poor communication. Called over 12+ times, constantly following up before I am able to get a technician."
5,"For a 7.5kg machine, i put 3 kgs (less than half a load) in and maximum water, they advised I am overloading machine and i need to use more water- what a joke for a 4 star water efficiency!"
6,"Their definition of ""troubleshoot"" is put clothing in bags and don't overload."
7,I have lost trust in the brand and quality of customer service. Never again LG. Life is not good!
8,"I do 2 washes a week on average; for one person (me!). One load with bed sheets, 1 towel and hand towel and floor mat, the other is office/gym clothes that are not really soiled but some black work pants/skirts. Rarely do I have a wash that I don't have to remove lint. I have one short-haired cat that does not shed much fur. Not dogs, no excessively fluffy clothes!! White sheets can come out with brown lint stains over them, meaning I have to put them through a cycle again. I pay for water where I live so this is not economical. The wash cycle I choose is the default wash not the quick cycle as at least this default cycle spins the clothes to be dryer. But it takes quite a long time. I am totally dissatisfied with this machine. Most major parts have been replaced due to faults in the operating when it was barely 1 year old. Mostly the OE error. Finding the lint filter is a nightmare. The machine can end up with an OE error and an incomplete wash cycle and you can't do a thing about it. Manually rinse and wring out the clothes!!!. I read this OE is the filter is clogged but every time a technician has been out, it is ""clean as a whistle"". So they replaced the motherboard. Next time the struts needed replacing, something the LG technician said happens on a machine nearly 10 years, not 2 years old. Recently it flooded and the OE error again. Incomplete wash and 6 towels to mop up the laundry and dining room inundation. Thank god I have tiles. Technician from LG, who was quite rude to me, said he ""could not replicate the error but would replace the pump"". Yesterday the spin function stopped working. Another OE error. More hand wringing. All the time I am asking for a refund because this product does not meet consumer expectations that it should wash your clothes and not keep failing. I have been told I have to use the 3 hours of super-heated water Tub Clean cycle (more water and electricity usage) once a month and put vinegar in the water to ""break down the lint"", and use de-scaler product to ""break down the lint"", and put the liquid OMO (the highest  rated product) into a cup of hot water before using it to reduce lint. 10 years with a Fisher and Paykel and never had to do any of those things. I have NEVER used fabric softener. But what if people choose to? LG don't recommend it as it encourages lint. The LG support centre refuses to give me a contact for LG Australia to communicate with. I have been told ""if it can be fixed, it won't be replaced"". Every time I call LG with a problem, they tell me ""but madam, you have only called us once before"" so they do not keep a track of all the times this machine has failed. I have had to ask them to consolidate all call records. So I have an 8.5kg machine with very little demand on it's fundamental design (to wash clothes) and it fails my expectations. It is only just 3 years old. I see LG not backing up their reputation by authorising a refund on what is very obviously the worst washing machine I have ever used (and many others after reading this web site). I am going back to F&P or Simpson. In short, LG needs to step up and look after customers. Very, very disappointed."
9,"I purchased my LG Washing Machine after my Fisher and Paykel of 20 years finally stopped working.  I did quite a bit of research  and both LG and F & P came up as very good products.  Whilst I may have preferred the F & P, I was limited by the lid opening space I had to my Wall Dryer hence the purchase of the LG."
10,"To date I have been quite happy with this appliance.  I read other reviews where people complained of the clothes being twisted and tangled and yes this does happen but as I usually hang my clothes on the line, it doesn't take much to untangle them.  It would probably be more annoying if you were putting them in the dryer."
11,"I find it washes the towels very clean (as good as if not better than my old F & P) on the towel cycle.  It doesn't seem to be too hard on our clothes.  I always do a cotton wash cycle.  To date I haven't really used any of the other options except a quick wash which is good for smaller loads.  On average the time for a wash is anywhere between an hour and an hour and fifteen mins and that is with a full load.  I am quite happy with no agitator in the middle of the machine and I do like the see through, soft close lid."
12,"I have had a problem on at least 6 occasions of the machine indicating there was a problem with the lid closing (code ""de"").  I have to wipe the contact points a couple of times to get the machine to start, so I don't know whether it is using washing powder vs washing liquid that causes the problem or it is a defect with the machine and other users have that problem too.  I have not rung LG yet to discuss this issue so I can't comment on what help I will receive from them but I will ring next time it happens."
13,Overall I am very happy with this product which not only performs to my satisfaction but looks good in the laundry as well.
14,"The machine has more high tech functions that will provide almost any wash combinations possible, Great value at the price and the warranty service is very good. But to start the machine the high tech self start packed in the first day and after repairs continues to malfunction. It is a technical issue that can't be solved as the item is way to over complicated. So when you get the error report tap the right side of the machine near the top and it works."
15,"I bought the LG 8.5 kg Top Loader washing machine, I had problems with the machine leaking water after the washing cycle is finished the machine keeps leaking water inside the drum, the inlet valve needs replacing it only lasted 2.5 years.I'm really disappointed with LG Washing machines and don't recommend it for anyone."
16,"Have been unsatisfied with this product and the way it washes. Swishes from side to side, barely cleaning any of our clothes. Detergent left on clothing (even when we have triple checked amounts used). Lint on every wash regardless of tub clean or filter clean. Have tried everything to fix from our end and no luck. Customer service gives same advice but it's obviously just the machine. Family members with same machine have experienced this also. Waiting for it to die and then never buying an LG again!"
17,Summary of the above washing machine purchased February 2018:-
18,LG's Selling points:-
19,"1) Big size, 9.5kg2) Programs are way too long.3) Supposed to allows us to wash quilt, blankets and pillows with ease4) See through glass on the top to see what’s happening3) Option to stop the machine to add items that you forgot to added in during washing4) Supposed to have advanced computerised operating options. To customise how you want the washing completed, including the number of rinse cycle, level of water, minutes of washing...etc which I thought was a great idea at the time of purchase5) The extra spin cycle gets clothes really dry, so less time needed to get the clothes to dry completely under the sun or in the dryer"
20,Negative points:-
21,"1) Large size, takes up room in your laundry space2) Hard to reach the bottom of the machine unless you have very long arms and I’m 5'7""3) The wash programs are way too long, 2 Hours for towels?  1.5 Hours for Eco Cotton? This is supposed to be a water saving and economic machine.  Not with wash cycles of this length.   The cycle’s programmes being too long which costs more electricity4) Fast Wash only does a light spin and leaves the clothes too wet to put into the dryer so you need to do an extra spin.5) Being a large machine, I have found with this machine I constantly had to check how much water the machine had put in as a lot of time there was not enough water to cover the clothes.  If you only have a small load of washing, you need to use Eco Cotton if you intend to use your dryer otherwise you either have to an extra spin on fast wash as the clothes are too wet to dry in a drier.  Despite being able to adjust the water level, you are still ended up using quite a lot of water, as you need the water level to be high enough to cover the clothes6) With the water level issues it is not a machine you can set and walk away as you have to keep coming back to check it has correctly done what it was programmed to do and is washing correctly.7)  DO NOT WASH DOONA'S DUVETS OR ANYTHING OF THAT NATURE.  I believe this machine has a design fault, and when I washed one recently which was under the 9.5kg load for this machine.  The doona floated up during the spin cycle and got caught somehow.  The machine sounded like a car doing a burn out and was extremely loud.  The machine melted the plastic top of the machine above the stainless steel bowl and there was a strong smell of burning, and there is no safety cut out designed into this machine if an item of clothing gets above the water level. This is a fire hazard and just not safe."
22,"LG currently refused a warranty claim which is still in dispute and which I do not agree with.  They claim if you wash sheets or doona's in this machine and they quote from the Washing Machine Manual that the items have to be in a bag or netting because the item may float up.  Tell me where you can buy one of those? Also if you need to put an article of clothing into a bag, isn't that to protect the clothes and not the machine?  If that's needed why are they not supplied with this machine on purchase or an option to purchase?  Also if they have this instruction in the manual and say that an item ""may float"" then they are aware there is a design fault in this machine."
23,"LG's service technician’s inspection of my machine in regards to the warranty claim was to lift the lid.  That's it no other inspection.  They then took pictures of the damage, attempted to accuse me of washing something that the machine was not designed for this is how they assessed my warranty claim from that inspection."
24,"When LG were asked why this machine had no safety feature to stop the machine if an article of clothing goes above the water level, LG has no sensible answer. This machine is supposed to be an intelligent machine with SmartQ."
25,"DO NOT BUY THIS MACHINE!!  I personally think it has a design fault and LG know this, FROM MY EXPERIENCE IT’S A FIRE HAZARD."
26,I would not recommend this machine to my worst enemy and I certainly would not ever consider another LG product especially after this experience and the attitude and treatment by LG.
27,Not overly impressed with this machine. The wash cycle takes forever. I have had multiple issues with the machine clogging up because of dog hair/fluff in the filter which took me forever to work out why the machine would simply turn itself off mid wash and full of water. Technicians were no help. I worked it out myself. Now I know I have to regularly pull plug out the back to remove any buildup which then fills the laundry with the water that is in the machine after the drain cycle. Not happy with the quality of the clothes that come out at the end of the cycle. I only have rain water which is put through filters so my water quality is excellent. I would much rather use an old twin tub than this shiny new expensive waste of money.
28,"Negatives are just too numerous. VERY LONG wash cycles, no manual programming for shorter cycles. Power outage means one hell of a headache to resume/finish that cycle, twists and tangles everything throwing it out of balance and no safety out of balance stop. No soft close lid anymore just slams shut, very noisy and rattly.Controls at front never have been a good idea on any appliance.Never had an LG anything before this and an LG fridge bought at same time.(also crap) and will not ever have anything LG again."
29,I bought a LG top loader as my daughter had one for over ten years and it was brilliant. This machine regularly doesn’t allow hot water in. Repair man said it was because our hot water was too hot or pressure too great!!  Suggested we purchase a hot water regulator
30,"I put day to day clothes all fabric types, kids, hi vis work clothesEasy to use, settings and functions, i use a variety of the options and cyclesGentle on delicatesIf i need to do a quick or longer cycle i have the optionI am pleased with the overall performance of the product"
31,We wanted this machine for quite a while before finally buying it. Its great - it cleans so very thoroughly and spins out very dry for a top loader. I love the clear lid - I can see whats going on and adjust as necessary. It almost never goes off balance like my old one and looks good as well
32,"Bought my washing machine based on the fact it has no agatater which  allows for easy loading of clothes & less creasing on completion of wash . I have done a queen size Dooner  in it with very good results . so happy I made this wise purchase ,& would recommend it to all my friends"
33,"I purchased an LG washing machine 10kg over 10 years ago and I have had no problems with it since. LG may generally be slightly more expensive than other brands, but in my opinion a wise choice, I used to be a fischer and paykel on all brands but having an LG clothes washer for so long with so many different settings although I only use one setting and just let it run. It runs for just under an hour and I find that it cleans my clothes, towels, blankets etc,  sanitises and conditions them and spin dries them very well and  when they are hung out to dry, dry in a very short span of time.For convenience the large 10kb capacity allows me to simply load my machine with general everyday items of a weekly wash for 2 persons and the wash is done in just under an hour.I have never washed my good clothes and delicates preferring to hand wash although there are several settings on my machine for this together with soaking. I just never trust machines to perform those tasks preferring to always hand wash since my very first washing machine, I think it was a singer wringer tub back in the 60's.So Kudo's to LG for an amazing reliable washing machine."
34,After pulling out my hair with our Simpson for years I finally decided to try this machine and haven't looked back since. It is super easy to use and oh so quiet.I think our clothes are finally getting a decent wash too. LG have a customer for life if it keeps going the way it is.
35,"we have had this machine for 2 years - not really happy with water use  - HATE the fact it ties clothes up into knots - then the PUMP STOPS WORKING.....a few days of trying to problem solve, a few more trying to work through the LG support service....3 times now i have had to ""Bail out"" the drum of water i cant get out any other way - Buying a F&P - never again - feel bad for the environment that 2 years it is crap, but cant go any longer going to laundromat to get washing done!!!"
36,We purchased this as I didn’t want a front loader and so far so good.
37,I find there is a lot of washing options which is great and it takes loads of clothes. The only thing I would say is that it is a touch louder than a front loader but only marginally.
38,So far very happy
39,"We got the Direct Drive 7.5 top loader, it is very high tech so took us a few test loads to work how to get the optimal water level, but once we know the setting we're after it is much better than our previous top loader/front loader washing machines.1 This clean and rinse well.  you have to choose wash at least 10 minutes if you have a big load.2 we only got it around 2 month so can't tell if it wears out cloth3 we live in a unit with laundry in the bathroom, and this machine is quiet enough (even in spin cycle) for us to sleep in the morning so Yes  it is quiet.  (when you pick washing machines at the store you can try to shake the drum, the support mechanism for this drum is very good so it is hard to move, which means the drum spins in the middle instead of hitting the side of the washer.4. Don't have a favorite feature, just like the quietness of the washer  :)"
40,I got extended warranty at Bing Lee as well so i am all good.
41,"This machine is the worst ever. It leaves cloths more dirty than you put them in. Covered in lint, fluff and scrud. For which LG suggests your run a clean tub program of 3 hours every 10 washes or so. If only it worked/helped. It does not. And that is after LG replaced the motherboard as the machine before destroyed cloths by twisting them together and tearing them apart. The Worst Ever."
42,We're not a fan of LG products but we bought this cloths washer because it was on sale and had a nice display panel. Loads of cloth options and also huge amount of room for super large baggy cloths or bed sheets and blankets or if like us you have a large family it takes a huge load.
43,"I was a bit sceptical when I was about to purchase this as I just had a LG issue with a purchase - a different company prior to that. Now,  I am loving it as I was previously using the old model of the same product which just got broken - have lasted for a long time though."
44,"This attractive looking machine stands proudly in the store with a great big stick on its front stating its fantastic for lint removal. Um, yeah not its not. Nicce to look at, reasonably quiet and has most cycles and features you'd expect from a washing machine designed for a big family. On the downside not only is it crap at removing lint with its monstrous size lint filters, but im starting to think it might actually have a secret lint making compartment. You'll  never wear black again."
45,"Works very well, it is very gentle on clothes, I like the easy cleanable lint catchers, I also like the fact that while the machine is filling you can add detergent etc. the only issue is the programming which I think is bit complicated. The machine runs very quietly that is good."
46,Had initial problems setting up the wifi feature as I couldn't find the password. LG took 4 days to get back to me with someone who knew what to do. My current problem is that it doesn't drain at the conclusion of a delicates cycle - am waiting for LG to get back to me a solution. Another problem is that despite the booklet saying you can set the soak time the machine seems to only do 30 mins - absolutely useless for baby clothes. I feel like it has less functions than my old Fisher and Paykel but there is nothing I can do about that!
47,So 3 weeks later I'm still waiting for LG to sort out this machine. A technician has been out and said it wont drain after the delicates cycle and to get it to empty I need to run another cycle - not happy! What a waste of my electricity and water!
48,So the soak - one technician advised just to do the load several times until the washing is clean. Totally defeats the purpose if it going to drain out the soaking solution. Still waiting (with a load of baby clothes waiting to be washed in the machine)!!
49,Technicians advise they will call by a set time - simply doesn't happen. This has happened numerous times and is very frustrating!!
50,"I'm in love with my new LG its stylish yet perfectly compact for my little laundry and smart. Ive never seen a washing machine spin as fast and as quiet as this, not waking my kids anymore i'm back to doing my washing of a night again. Awesome yet again LG."
51,"This washer does do a good job and clothes are cleaned well, but the big disadvantage for us living on tank water is that it weighs the load before it decides how much water to use. This means that any wet clothes that you might have had soaking, or very damp towels, make it use more water. It also means that you can't tip in buckets of water collected as the shower heats up.  You can adjust it to a manual wash but I have to get the manual out every time to do this. Plus it makes you do a tub clean occasionally which uses water. I just wish it didn't decide water usage on its own."
52,Bought this machine 2 January this year and am nothing but problems with lint deposited on everything.
53,"I can wash say towels one day, and even 3 washes later, lint from towels is deposited on my clothes."
54,"LG want me to pay to have a tech come out and inspect the machine and if it is faulty, they will give me a remedy."
55,"I refused - told them that if there was no manufacturing defect, then it proves the machine is crap - and I will take it back to the store and say it's not fit for purpose and get a refund."
56,"This may turn out to be a long process, but judging from comments here, I'm not alone with a lint problem so it's an issue and LG would be aware of it."
57,This top loading machine is performing well and very quiet. It has many water levels  and washing cycles to choose. The normal cycle is very long so I ussualy chose the quick wash. One problem with the machine is that the machine is very deep you have to make sure that you are comfortable to reach the cloths at the end before you buy the machine.
58,As per Zoso I also called to have my machine's glass lid fixed under warranty and was told I had misused the washer. I called Consumer Affairs who said the words 'safe' and 'durable'. Their glass lids are clearly not durable!. I will continue my demand for a free replacement. I rated this company policy as 'terrible' but the machine itself is in my opinion excellent.
59,To get the only negative out of the way quickly unless you are over 170cm tall it is hard to reach the bottom of the wash tub.However positives are that there is no agitator so it can take large items like pillows or duvets reasonably easily and do a good cleaning job. Lots of functions which are easy to set and change to your requirements.I like the clear glass lid so you can see what is going on.After having had a F&P for 15 years I was anxious changing brands but to this point in time no complaints.
60,"Really happy with this purchase. Very quiet and has a glass lid that you can see through. Auto weighs the load and selects the water level (you can adjust it if you need to). You can also add items in after its started which is really handy. I like that it doesn't have an agitator, and haven't had any problems at all with clothes getting tangled up (I do use a lingerie bag for stockings and other delicates though). I find it a little bit small to be able to fit a queen size doona cover plus a full queen sheet set and pillowcases all together in one load. Otherwise very happy with the 7.5kg size. Very happy with the way the clothes come out. Clean, no stains from any build up etc. I'd happily recommend to friends and family."
61,"Washes ok, not particularly good or bad. Does seem to leave lint all over the clothes and doesn't leave them very dry after the spin cycle. The machine also can leak if not set to the right angle (not actually level) as spray during the rinse cycle can bounce off drum and down the inside of the machine on to the floor. Most disappointed to discover that the manual cautions you to never wash any waterproof or water resistant items in the machine. So no parkas, mattress protectors, ski clothing ... Pretty useless."
62,Rinse and dry clothes perfectlyLess wrinkles on clothesIt's relatively loud when rinsingVery engery efficientPerfect size for one big loadClothes do not wear out at allIt has all little functions like you can choose or adjust water level depending on how big your load is;  easy adjusting time ; many options for washing;
63,"I have had MANY washing machines over my life- this is the most expensive and the WORST!-- Does NOT wash cleanly, leaves lint all over clothes, does NOT go through spin cycle,- off balance! NO short- quick cycle. 55 mins, and only allows low water level. Disgraceful!! Also- bowl too deep for normal people!AND- twists clothes up- I cannot afford another machine- I am stuck with this!!it does not allow for manual override of settings, so there is NO control of this machine.I have to stay close by to watch - as spin cycle stops, and starts filling water again, which is not good, especially on tank water.sometimes 1 load of washing can take 2-3 hours!! This is SO frustrating and disappointing!!!"
