64,This machine is fantastic. Cleans clothes beautifully without tangling them.  Also very quiet to run.  The only issue I have is the length of the cycles.  I have had an LG prior to this one and decided they are such good machines that I would purchase only LG this time.
65,Recommended tub cleans 5 hours! Filter at the back on bottom of machine. Lint on clothes! Worst machine ever. LG spokesman said they could send me some troubleshooting ideas! Very disappointed. Would never recommend this machine to anyone. Even the cycles go fircway too long ... never again.
66,"A sturdy washing machine that cleans and rinse well! We wash our clothes and baby clothes separately. So far, everything has been holding up well. In terms of loudness, it is as loud/quiet as any other washing machine, I think. However, there are times when we wish the wash cycle can be quicker because time management is so important with newborns in the family."
67,Tangles clothes and covers everything in lint and doesnt clean well at all never puts enough water in hard to reach the bottom of machine and the stupid lint filter is at the back so u have to pull the whole machine out to get at it impossible by myselfregret buying this machine
68,Filter on bottom back of machine making it hard to get to. Even after cleaning filter clothes are still covered in fluff. When washing clothes it hardly even moves so I don’t think they are getting washed properly. Going back to a front loader. A lot easier to use and get a cleaner wash with no fluff.
69,"I absolutely LOVE, LOVE, LOVE this washing machine!"
70,"After seven years of despising my front loader, I was adamant that when the piece of junk finally died I would return to a top loader. Having no experience with a top loader with no agitator, I wasn’t too sure what to expect. However, so far I am stoked with the results. My clothes haven’t felt this clean in years. It evens cleans smelly old dog blankets to the point that there isn’t so much as a whiff of that gross doggy smell. The capacity is also large enough to handle queen sized doonas without any dramas."
71,This machine is quiet enough that I can do loads at any time of the day or night without disturbing anyone (important when you like to wash at midnight and live in an apartment complex). The song that plays at the end of a load is also relatively quiet and only plays once (a big plus for me).
72,My only gripe is that there is no wool cycle which is annoying as hell but that was my bad for not paying attention to the various cycles in the specifications. I simply just wash my woollens on a warm cycle without the rinse cycle and then hand rinse in warm water.
73,"Also, to the people who have experienced tangling, I would suggest increasing the water level on the load. I have only ever experienced tangling when I’ve tried to be stingy with the water levels. When I am a little more generous with said levels, I don’t get the tangles."
74,"As always, Appliances Online made for a fantastic buying experience."
75,It’s top-lead washing machine.We used to front-door washign machine but it wasn’t cleaner than top-lead washing machine.It’s quite quick and we can get quite nice result.I just used to use standard course (cotton and quick)It’s not loud and it doesn’t disturb my other tasks.It’s capacity is 9.5kg so we can wash our blankets and a lot of laundry.I think our family love this washing machine.
76,"The slow release lip function is great. It is quiet and clean. The circular hard filters are also easy to clean. It is also very gentle on the clothes by using the right cycle. However it is still a bit too small to wash the big blanket, I wish I have bought the 9.5kg model."
77,"This washing machine is alright, quiet, and perfect for small family. It has a control panel which allows you to select your mode easily. Even for the water level, so you can save some water when required and when you are washing less clothes. Price is reasonable around 700 AUD."
78,I love this machine. Especially that there is no agitator clothes don’t get tangled around the agitator because there is none! But it cleans everything really well love the turbo air drying it’s great in winter. Also love that there are no messy filters to clean and it lets me know when I am due to do a tub clean which takes a while so my advice is to let it do it over night or on a day your not going to be washing.
79,"clear cover，less noise than my previous one. Not clean well, but reasonable. some clothes I have to sork it and hand cleaning. One thing I don’t like it, when I chose cold water only, the system still go hot water and cold water.over all , the machine is functional, I paid 500 aus dollars for it."
80,I have owned 2 LG top loaders. It's working well after 5 years and I absolutely love the quick wash fuction which only takes 30 minutes. And I used the quick wash a lot because I have a little one why I do the washing in a daily basis. Highly recommended
81,"This machine is not loud, and it does a good job cleaning my clothes. Drying is average. It is quiet and I forget that it is on. Which is not a problem because it turns off automatically after washes. The only down side is that it takes awhile to weigh the clothes"
82,This washing machine looks good and is very quit. Doesn’t jump around like my old one. Not having an agitator is fabulous for washing duvets however on some of the linger cycles certainly tangle the clothes eve though we were advised that this didn’t happen. Majority of the cycles are really long and the quick cycle whilst only just over half an hour only allows for a low water level limiting the items.
83,"I enjoy the slow release lid and the glass top.It washes well and the circlular hard filters are easy to remove, clean and have done well catching lint.The limit of wash choices is frustrating and the lid cannot be up whilst the water is filling which I liked from previous model.Our appliance had damage on the side from warehouse movement which we were unaware of until opening. We live hours from the shop and therefore either party were willing to pay returns. I would reccommend more packaging inside the box to prevent damage."
84,Wash’s great need to use quick wash as the Cotten wash takes over 2 hours. It’s very quiet and only beeps a short time when finished. I love the extra air dry feature so your clothes don’t take a long time to dry. I love that you can fit a large blanket in it and it will be washed
85,"Ok, so all washing machines work until they don't, right? Well this machine is no different, was great at washing clothes until it stopped working at 16 months old. What followed was the most harrowing experience of my consumer life, and is still not resolved."
86,"LG customer service is non existent. Worse than non existent, because it masquerades as a service. You will be able to speak to someone, they will follow a script perfectly acting as if they would like (and are able to) help you, however they and LG couldn't give a fig about repairing and subsequently replacing/refunding the machine."
87,"We have been waiting for almost 6 weeks now. Have had had no calls returned as promised, always having to call LG, and re-explain the situation. We have had to take off 5 separate days from work to wait for the service technicians. We have had LG order the wrong parts, lie to us and hang up on us when we were asking (ok probably demanding by the end) for them to either fix the machine, or replace it, or give us our money back so that we could buy another."
88,Instead we have been left in a pityless limbo with mounting piles of laundry and no help in sight.
89,"To summarise, avoid like the plague. These things will break eventually, even the $$ Bosch/F&P do, but if you can afford an extra $100 or two DO IT! Customer service is worth it. (My colleague had her Bosch break at the same time (2.5yr old machine) it was assessed and replaced all within 1 week.)"
90,"My suggestion AVOID. If you have one, call as soon as you have a problem, dont wait!"
91,"UPDATE:I sent through the ACCC letter of complaint and voila LG inform us that they have 'approved' for the Good Guys to provide us with store credit, waiting now to hear for how much. 24-48hrs."
92,"As soon as I bought lg washing machine and got installed, 24hrs later had a phone call from lg that the particular model needs an update service.. Why? It's brand new?! They came down and said needed to be adjust cause water gage didn't work properly! It seems to be sorted then I had my first wash and realised the machine did not clean my clothes.. I had make up on my top which (is water based) it normally gets clean from my old machine but twice went through this lg machine and both times it came out still dirty. Hand wash got it out immediately.. I've never hand wash until I got this lg machine. My baby had urine on the sheets and the machine did not wash it out. Hand washing again was more effective. I called up regarding the machine but got refused the warranty cause the machine is not faulty! Numerous times on call waiting from the Good guys, all of them told me to call up lg. I'm so upset spending this type of money and getting nothing in return. I'll never buy lg brand machine again ever! I'll never shop from The Good guys either! Fast to take your money but no help whatsoever."
93,I love this machine. It looks awesome and it washes so well. Very quiet and I love there is nothing in the middle of the barrel like old machines used to have so nothing gets caught and tangled. I am sure this is much gentler on your clothes too. I am impressed with the LG brand of products.
94,"Had it five months stopped spinning and rinsing took four weeks to get fixed , worked for three days and started doing it again, wont fill with water wont rinse wont spin. Never again LG Keeps saying hose is blocked starts a cycle and gets to 38 minutes and just keeps pumping, substandard machine."
95,"I bought this machine with high hopes and it started out ok. About 8 months into owning the machine I have had it repaired 3-4 times. The machine tub became loose somehow, and is super loud, and bangs around so much that it moves almost a metre away from the wall. The machine has now scratched sides from hitting the laundry tub whilst spinning violently. The repair guy has tried to resolve this problem twice already. It then also got the occasional error codes that it was not draining well, and a part needed replacing. Then after those repairs, the sensor immediately stopped working properly and would only land the water level at 1. So to wash a load properly I would need to stand by the machine, check its levels, and check in whilst draining and spinning to make sure the machine washed and stayed in place. Not really a justifiable use of time when I have kids and work!Now I'm being told the whole computer board needs replacing.Really!! I think I deserve a new replacement as 8 months with all of these problems, just means its a bad faulty machine!! Not happy LG..."
96,"Update: computer board was replaced, and the next day the same problems are happening. Machine sensor doesn't work. Very loud spin cycles with tub constantly loosening and machine moving roughly. I called LG explaining problems and asking for a refund, and I was told it would be brought to the attention of the manager and my call would be returned same day. One week later I'm still waiting for that call.I think its time to take consumer affairs action!"
97,"First wash took forever, just for towels 1hr 50min? Second wash I used the quick cycle and went out for a walk only to find when I got back it had stopped for unknown reason. Turned off and back on and it restarted. I have a weeks worth of washing to catch up on from having no machine and each cycle seems way too long plus twice it hasn't seemed to have added enough water and the instructions say you may have to adjust this.  What a pain!  They are quite deep and as a short person I find it hard to reach the items on the bottom. On the plus side, the clothes come out very soft, seems to use less water and detergent. I am getting used to the settings but the manual is not very good at explaining how to set your own wash so it has been trial and error. I hated in on day 1 but have since decided I do like not having an agitator in the way and we are making friends slowly!  You can fit lots in. The water level is a pain, as on occasion it doesn't seem to have filled enough. Takes some getting used to but I think I like it now and really happy with the softness of the clothes. Its very quiet, and I haven't even used the quiet cycle yet. Soft close lid is great."
98,"Clothes come out clean,  well rinsed out. Never damaged any clothes. Has a gentle cycle and quick wash. Really great washing machine. I have always been happy with this machine. Never had any faults or problems. I like how you have so many choices to wash with as well as the glass top to look on whilst its cleaning."
99,"The washing machine is a superb cleaner and the spin some times makes the clothes so dry that just in few hours its all ready to be kept in the wardrobe , my daughter likes the music at the end. she will walk around around the final rinse to hear it at the end . We have finally found what we needed in this master piece."
100,"It does not wash properly, often lint on everything. Clothes are not clean if they end up with more lint than when they went into the wash!!It shows an EO error that the filter needs clearing but you cant get to the filter....what is the point of that? 2nd service visit and I want to hear WHY this machine has so many problems (eg no unbalanced load error - just banging the bowl against the machine casing!. The lid inconsistently locks (it should) or not, the computer board was completey replaced at 12 months. I am very unhappy with this machine."
101,"It cleans Well and does not wear out or Damage any clothes, can be quite loud at times and it has the quick wash function which is handy, Favorite feature is that you can add on more by just pausing and adding more washing.The only problem is it tends to make loud banging noise if the machine is full, especially while washing heavy towels and Bed sheets, have to pick the right washing mode for every clothing, apart from that it is a great machine."
102,"Love this new lg no agitator great for clothes no tangle twisting, nice deep drum, a little to deep for me being short lolgreat finish, lots of washing choices.See through lid, soft close lid, Tells you when you need to do a clean basin wash.Easy to use touchpad."
103,"the clothes get cleaned ok but unless you increase the water level, they come out all crushed.  It is simple to use and sometimes the clothes still have marks on them, but that could be my detergent.  Today it is very hard to find a washing machine that rates as good as the old ones and lasts as long."
104,"Good washing Machine, I feel like my clothes are coming out much cleaner then with my previous model. Machine is quiet, easy to use. I really like that it has a quick wash option that still actually washes my clothes well. Also the 9.5kg is a great size for a family."
105,"The machine is worthless, a lot of LINT issues.  Also Support is terrible, they give you the run around and avoid any form of refund. Spent ages trying to trouble shoot, where the problem is the LG brand itself. The product has false advertising about auto lint removal! LG should be fine for false advertising and support goes to the Philippines where they don't care or respect their customer."
106,"The more they complicate the process, the easier it is to stuff up the works. The machine is simple enough to use, but it doesn't do a great job and for the brand and money paid, I expect it to be better.I have no idea why the machine has to dance a little jig before each and every wash, what the hell is that about? hy can't the machine just fill with water and start like they used to? The drum goes through this dance motion as if it has to limber up before a big match.I don't feel that it washes the clothes properly, and clothes regularly come out all knotted together. If that's what happens then how can clothes possibly be washed adequately?The timing is also completely off. Once you set it, the time can be 1 hour and 6 or 7 minutes etc, however several of those minutes are used while the machine fills. Another couple of minutes are used while the machine does this weird spinning action, (god knows what that's for), you then may be left with about 55 minutes of washing time which is so inaccurate it's laughable. Several times I've watched this machine allegedly washing clothes while the drum is hardly even moving. How can clothes be possibly washed in this manner. Then the timer may tell you that there's 35 minutes left, however come back and check on it 40 minutes later and it's still going. I watched this machine tell me that there is one minute left of its final spin and stood there for 3 minutes waiting for it to end. How long does 1 minute last in the LG world?Maybe I need to locate an old dial and set machine that clicks along when it goes through its various stages as I feel they washed clothes better and you had more control over how it operated. This thing is useless."
107,"Wish I had checked the reviews before purchasing this machine. Worst purchase we have ever made. 2 major issues1. Clothes come out with white residue/lint no matter what we do. We have tried all options as advised by customer service ie: changing type of powder used, manually selecting water levels and running numerous rinse cycles. Have run numerous tub clean cycles but the problem persists2. LG customer service is non existent. After numerous calls and wasting time being placed on hold the best that LG could do was to ask us to send a photo of the clothes after a wash showing the residue/lint that is left behind and email that to them"
108,Cleans really well clothes feel a lot cleaner then my old one it is very quiet I love the lil music chime at the end of every wash and my favourite feature is the soft close lid haven’t had a problem with it yet it’s the best washing machine we have had in a long time
109,The washing machine is huge it fits in a lot of clothes and washes them excellently every time. It is a tad noisy when on spin mode but it’s better then my old washing machine. It’s has many different modes to use. I have never used it on hot so don’t know how it goes with shrinking clothes.
110,This is my first top loader washer and I'm impressed. We have the 9.5kg and it is large enough to wash blankets which is a bonus. It has a quick cycle for washes under 3.5kg. My only issue with this washer is it leaves lint.on your clothes as it doesn't have a long filter to empty. It is a quiet machine and even has a quiet cycle.
111,"Great machine.quiet, efficient, good clean wash, had it for quite a few months now.no problems. One  thing not covered in manual -- the sign CL which means child lock.to open the lid again when lid locks you have to put finger on the rince button and hold it there for 3 seconds. Marvelous to know it locks if kids fiddle with buttons. Luv this machine."
112,"It cleans the clothes very well.A bit noisy . Reducing noise would greatly improve rating. My favourite feature are the different setting jt provides.Overall good quality and would recommend it to other people to buy. But keeps getting an error 1E, i dont know what it is ."
113,"Another item of necessary household equipment that my son needed when he moved out of home.  He appears to be very happy with the overall performance except he told me it doesn't load the clothes nor hang them out to dry...  This is something all sons realise when they leave home.....  His clothes appear to be cleaned well - not always ironed correctly, but that's another issue.  Overall, very happy."
114,This new LG Top Loader (2017) replaces a similar LG Top Loader purchased 1999 and which had given excellent service over that time.The washing cycles are now more complicated and we have hung the Manual next to the machine so that we can learn how to get the best from each cycle.
115,"A FEW GOOD TICKS:*Tick for the automatic lint filter which does not need emptying, we are getting a cleaner (almost) lint free wash.*Tick for the Towel cycle, this is becoming our favourite all-purpose cycle as it spins the water through the clothes to saturate and distribute the load – this cycle is doing a good job on all fabric types - but we do have to manually increase the water level.*Tick for the manual Ultra Spin function, being able to spin to damp-dry is very efficient.  Haven't tried the Air Dry yet, should be helpful in rainy weather.*Tick for no central impeller, able to easily fit pillows and duvets (but not necessarily at the same time!) in the generous bowl*Tick for how quiet it is across all cycles*Tick for how fresh the clothes smell - same water, same laundry detergent, but a distinctly fresher smell!"
116,"NOT CONVINCED AS YET:*Umm (jury is still out) for the fuzzy logic – as with the old machine Fuzzy Logic cycle, all the water levels are too low and have to be manually increased.*Umm for the complicated wash cycles – but Tick that we can create our own Favourite cycle and use that."
117,"OVERALL:We are very pleased with and happy to recommend, our new LG washing machine"
118,"Upgraded to this washing machine after the first one was faulty and had been discontinued. I find this machine quiet and with its large 9.5kg drum size, we are able to wash large loads of washing at a time. The biggest downside is sometimes it doesn't seem to clean the clothes adequately and tangles them."
119,"Great machine that can do so much. I do shift work and sleep all hours, so this machine fits my lifestyle well. The washing builds up over the week until I have time. I can fit a weeks worth of uniforms, clothes and queen bed sheets with no problems. I find it washes & rinses well, it is quiet and doesn't take long for the clothes to dry on the line. I like the duvet cycle for when you do the mattress and overlay covers, along with the doonas.  Ease to use, sort, add detergent and press start."
120,"It clean the close only if I wash with warm or hot water ‘it is a very quiet machine overhaul it rinse and spin dry just fine ,it’s very compact fits in a small place perfect for a unit ,looks good and I also like the glass within the lid"
121,"Our old washing machine died and we replaced it with this. Didn't realise how bad our old one was! This cleans our clothes so well, no marks are ever left over. The machine is super quiet despite spinning very fast, great range of functions to choose from as well. Love it!"
122,"We were taken in by the fact that the agitator is on the bottom of the barrel and thought clothes wouldn't get twisted around a central agitator , however , we were wrong and sometimes we can just lift the entire load out in one movement as every item is so intertwined . we also have a lot of trouble with lint on bigger items like sheets .  I'm of medium height and it's an effort  to reach the bottom of the barrel to retrieve  items . All in all we're not happy with our LG washer ."
123,"It washes SOOOO Clean and there is absolutely NO residue left after the rinse cycle.I love the fact that I can set it for extra Rinse Cycles if I wish.I have used the Delicate cycle for our Woolens, they have come up so soft and clean they will store ready for winter beautifully."
124,"Cleans well & spins out very well if set to Ultra. There are many different settings/combinations & it is worth while experimenting a little with these to discover the best wash for different items .It does not appear to be too hard on the clothes & is reasonable quiet. Takes big, thick quilts & washes them well. No agitator means items are easy to place into & remove from the drum.No filter I believe results in occasionally some fine fluff being left where clothing has been folded during final spin.If it cannot spin due to the washing being unbalanced it will frequently reload with water in order to attempt to re-balance or rearrange load instead of stopping with a warning beep . For some people this may be a good thing however if you are water conscious or on tank water this is a problem.Overall have been happy so far with the machine."
125,"Rinses perfect, keeps clothes in good condition, Would not even know its on... my fave features are the was cycle...After having a front loader then going to this top loader i would never ever buy a front loader again not to mention buying another brand. LG is definetly the machine to purchase.."
126,"This is a good machine, I am happy with our purchase, does big loads without any problems. Never gone off balance. Has a tub clean feature which is excellent, easy to access and clean filters (which was a feature I needed after a terrible previous machine's filter broke and was unable to be emptied). The tub dry is great, i put heavy loads to slin for an hour and it saves line dry time and saves things ending up in the drier as much. The delay start is awesome, i love being able to set the wash and hang it out first up in the morning. My only negatives is that i wish i could soak longer than an hour and also i have to wait for the end of the spin cycle to use the tub dry feature, you can't just make it spin for an hour at the end of the rinse, its a separate manual thing you have to do. Would recommend."
